{
  "configPath": "/Users/me/.a2/url-router.json",
  "configSource": "unusable",
  "problem": "配置文件不是合法 JSON。",
  "config": {
    "fallbackBrowserBundleID": "com.apple.Safari",
    "routedDomains": ["claude.ai", "claude.com", "anthropic.com"],
    "roxyApplicationPath": "/Applications/RoxyBrowser.app",
    "roxyProcessMatch": "/RoxyBrowser.app/Contents/MacOS/RoxyBrowser",
    "roxyProfilePathMarker": "/browser-cache/",
    "roxyProfileID": "",
    "roxyAPIHost": null,
    "roxyAPIOpenPath": "/browser/open",
    "roxyAPITokenHeader": "token",
    "roxyWorkspaceID": null,
    "roxyForceOpen": false,
    "roxyAPITimeoutSeconds": 5,
    "roxyStartupAttempts": 10,
    "roxyStartupDelaySeconds": 0.2,
    "roxyAPIKeyConfigured": true
  },
  "panelBundleID": "com.a2.panel",
  "handler": {
    "http": "com.a2.panel",
    "https": "com.a2.panel",
    "matchesTarget": true
  }
}
